text,label,source_emotion,subreddit,notes
"And then there's ""having to listen to parents bragging about how hard they have it"" tired.",neutral_observation,neutral,childfree,
Ah yes three of my ~~best friends~~ worst enemies,critical_reaction,disappointment,traaaaaaannnnnnnnnns,
You completely missed the point of the meme...,uncertain_question,realization,PoliticalHumor,
All of Disney is cringey. It needs to be stopped,critical_reaction,annoyance,4PanelCringe,
"You’re welcome, glad to help!",supportive_reaction,gratitude,JordanPeterson,
That would have been cool for sure,supportive_reaction,admiration,Tinder,
"It was not my ex, I just watched her in action.",critical_reaction,disapproval,datingoverthirty,
Avid Android user here. My Xiaomi Mi Mix 2 is by far the sexiest and fastest phone I have ever had. Such bliss when using it.,neutral_observation,neutral,Jokes,
No offense are you guys actually dating? Are you paying for every thing. Have u guys had sex?,uncertain_question,curiosity,TooAfraidToAsk,
The internet never ceases to surprise,uncertain_question,surprise,heroesofthestorm,
How do they know how far away the FRBs are coming from,uncertain_question,curiosity,worldnews,
Team Arrow getting stalked and sent threatening notes Also I'm :( for the [NAME] part.,neutral_observation,neutral,arrow,
I'm surprised he survived the primary.,uncertain_question,surprise,VoteBlue,
We’ve been watching OP for awhile and warned him about his posts. This one doesn’t rise to the level we warned him about.,critical_reaction,disapproval,Portland,
"That's a giant, adorable, super-good woofer you got right there!",supportive_reaction,admiration,youseeingthisshit,
It is being talked about all the time on this site. What are you on about?,uncertain_question,confusion,socialism,
She had the glory of being a virgin martyr. Eternal glory is hers.,supportive_reaction,admiration,Catholicism,
"""Talk about vaccines again and your next shot will be from my gun... of crystals bathed in essential oils""",critical_reaction,anger,vaxxhappened,
I was rather curious to see the True North Church receiving $1m from the lotteries commission.,uncertain_question,curiosity,perth,
"That guy is an actor. Forgot his name but he's in imdb, played small roles.",supportive_reaction,admiration,sadcringe,
They made the same few songs over and over again. Problem is I love those songs so I'm not too bothered. Personally love them.,supportive_reaction,love,lewronggeneration,
">If you were to confiscate $900 billion of [NAME] assets, lmao",neutral_observation,neutral,PoliticalDiscussion,
For real. I get tired of all the griping. Deal with it or get out.. or start a freaking riot and make changes.,critical_reaction,annoyance,Teachers,
The paratrooper theme fits very well with his jump! Keep up the good work.,supportive_reaction,admiration,Smite,
Interesting. I’m wondering if nutritional therapy might help her.,uncertain_question,surprise,DeadBedrooms,
Become a [NAME]. Here's your first step if you want to take the path;,supportive_reaction,caring,lostgeneration,
"Migrants are here legally, illegals aren't. There is a huge difference.",neutral_observation,neutral,politics,
Mine were huge. I wasn't comfortable until I had them reduced. Now they're awesome.,supportive_reaction,admiration,askwomenadvice,
We don't lmao. Anything with humans will have the same problems.,critical_reaction,annoyance,Libertarian,
i actually didnt know that there are people out there using quotation marks for emphasis until that weird [NAME] song,neutral_observation,neutral,insanepeoplefacebook,
"No, you said you think she deserves whatever she can afford. Can she afford housing?",uncertain_question,confusion,TooAfraidToAsk,
"That's not the point. It's not supposed to be unexpected, this subreddit simply is dedicated to the memorial today.",neutral_observation,neutral,Unexpected,
"The first guy had his balls covered, he knew.",supportive_reaction,approval,WatchPeopleDieInside,
Wow you’re pathetic for calling out someone who did something right,critical_reaction,annoyance,pettyrevenge,
Or you just get rejected and then not murdered and your anxiety worsens until you can no longer approach women or even men.,uncertain_question,confusion,2meirl4meirl,
"[NAME]? He doesn't steal it, and he acts like shep in me2. But yeah, the picture looks like [NAME], more than a femshep.",neutral_observation,neutral,masseffect,
">Also, you realize that both parties largely dabble in identity politics. Oh absolutely! It's a major reason I hate [NAME].",critical_reaction,disapproval,moderatepolitics,
Can a mediocre bot invent Facebook?,uncertain_question,confusion,FellowKids,
Nice! You and her would get along i bet. She loves her crafty machines and creative people. 😇,neutral_observation,neutral,The_Mueller,
Wow that is the exact armor combo i used to use,uncertain_question,surprise,forhonor,
"Such an ignorant comment, his reasoning is public information and is right",supportive_reaction,caring,vancouver,
Oh no you didn’t just quote tlc...👍🏼,critical_reaction,disapproval,adultery,
"So it's we now eh jerk-off, as in troll farm to creat FUD and drive the premium up on the order book. I knew it.",neutral_observation,neutral,QuadrigaCX,
I'm still confused about what a ginch is,uncertain_question,confusion,holdmycosmo,
"Oh, gotcha. I have a friend with unipolar depression who does have memory issues, so yes, that can happen during depression too.",critical_reaction,disappointment,bipolar,
Professionally.... no way I could do that to myself,critical_reaction,disapproval,confession,
I'm in phoenix today for work. The weather here is great. It's all rainy and cold in seattle this time if year.,supportive_reaction,admiration,Divorce,
I need like a drawn out visual or something,neutral_observation,neutral,pettyrevenge,
This is doubtful...he just won with over 50 percent,uncertain_question,surprise,VoteBlue,
> Consult /r/ssbbw (NSFW) for a better answer. Thanks. But no thanks. I'll take your word for it.,supportive_reaction,gratitude,Advice,
Also shout out to [NAME] for continuing his hard work and not giving up!,neutral_observation,neutral,torontoraptors,
This thread will be interesting.. *grabs popcorn,supportive_reaction,approval,ABCDesis,
>West Covina That just happens to be where [NAME] lives!,neutral_observation,neutral,Whatcouldgowrong,
Hated her. And that was honestly a more offensive reaction than everyone laughing at her IMHO,critical_reaction,anger,BravoRealHousewives,
The inventor of the joke came up with it during the [NAME] administration.,neutral_observation,neutral,Jokes,
"gamers rise up. Let's get this bread for our brownies, bois.",supportive_reaction,approval,Browns,
This is also (as an exmo myself) why I love her. She is awesome.,supportive_reaction,admiration,lgbt,
There was a weirdly similar post to this on LegalAdviceUK maybe a couple of days back.,uncertain_question,realization,bestoflegaladvice,
If she hasn’t told you where she lives it’s too soon to send flowers...in my opinion.,supportive_reaction,approval,datingoverthirty,
Don't like having different stripe profiles on the shoulders to the front of the shirt. One or the other.,critical_reaction,disapproval,Gunners,
Oh. You’re one of.... ^*those.*,neutral_observation,neutral,cringe,
[NAME] is the most useless phantom thief change my mind,critical_reaction,anger,Persona5,
"Yeah, I’m curious how these notes are “passive”.",uncertain_question,curiosity,Portland,
"I don't think there's any ""most women"" on this. For me, it took well over a year after my marriage broke up.",uncertain_question,realization,AskWomen,
"Thanks, but I am most certainly broken.",supportive_reaction,gratitude,dating_advice,
Always go for someone you like and feel connected to.,supportive_reaction,approval,datingoverthirty,
"It's disturbing that this tweet got so many likes. Like, this is why twitter has a cancerous reputation.",critical_reaction,disappointment,thatHappened,
For a moment I thoughts it's a Friends reference until I saw what sub this is. I TAKE THEE RACHEL,neutral_observation,neutral,Judaism,
"I'm glad the bears lost, but damn I feel so bad for [NAME]. The entire Chicago fan base will want him dead",critical_reaction,anger,detroitlions,
That illegitimate-no-good-dastardly-basterisk deserved what he got!,critical_reaction,disappointment,IDontWorkHereLady,
"Only if the fights are between chimpanzees. [NAME], those things will tear you to shreds",supportive_reaction,approval,MMA,
"Oh my, liberals have been busy haven’t they?",uncertain_question,realization,gunpolitics,
He reminded me more of [NAME] last year. His lumbering skating this year makes him look different.,uncertain_question,realization,canucks,
"I don't know why he'd take it like that, he was gone for so long so someone was going to do a show like that.",critical_reaction,disapproval,SubredditDrama,
"Tyl has got to be the most cringey, condescending thing I've seen on Reddit in a while.",critical_reaction,disgust,moderatepolitics,
"He was not my boyfriend then, duh.",critical_reaction,annoyance,seduction,
"Democrats never had complete control, that is a common misconception/lie.",critical_reaction,disapproval,environment,
"Although cool, it is not a bridge, it is road through snow.",neutral_observation,neutral,thalassophobia,
"I thought that too, just work hard you’ll get there",supportive_reaction,approval,Target,
"I swear to [NAME], if you don't use vinyl records, you're THE definition of ""The Complete Douchebag"".",critical_reaction,anger,RoastMe,
"They 100% know each other, maybe not personally",uncertain_question,realization,BreadTube,
definitly whining my dude,supportive_reaction,approval,forhonor,
"Not on academical level, but on family and bonding and respect for people who have lost their dearest ones",critical_reaction,annoyance,WhitePeopleTwitter,
Yes but what other sources are there?,uncertain_question,confusion,exmuslim,
"I said ""try."" Red wine is a thing for a reason",critical_reaction,disapproval,JUSTNOMIL,
">[NAME] and [NAME] As alternate costumes of each other, right? Not as separate characters?",supportive_reaction,approval,MortalKombat,
That sucks :( are you guys still in good terms though?,critical_reaction,annoyance,LGBTeens,
So you'll bleed and be in pain twice that day.,critical_reaction,annoyance,NewYorkMets,
If those people abandoned you for sharing how you feel then they are not your friends,neutral_observation,neutral,depression,
"Wow, if I hadn't seen my mom's cat recently I'd think this was him! I hope you find the owners",uncertain_question,realization,Denver,
"I'd buy this and use the ""wash, dry, fold"" setting exclusively. Sounds great to me.",supportive_reaction,gratitude,childfree,
"I used to sell appliance parts. Yes, I need your model number. No, the part you are looking for isn't ""standard.""",critical_reaction,disapproval,TalesFromRetail,
There is something legitimately wrong with you,critical_reaction,disappointment,NYGiants,
"Hopefully they can bounce back and take out the anger of this loss on the pistons, then start a new win streak",supportive_reaction,optimism,MkeBucks,
This converstaion reminds me of this old [NAME] cartoon. Apparently some people were upset by it.,critical_reaction,disappointment,news,
"Drives to work, realizes its a holiday because nobody answers their phones. Still stuck at work... nothing to do. We dont get paid holidays :(",critical_reaction,disappointment,AdviceAnimals,
Damn it if that isn’t the most accurate description of growing up.,critical_reaction,disappointment,drunk,
My knees shattered and my collarbone broke just reading this,neutral_observation,neutral,Portland,
You should call the police and tell your friend maybe you can Stay over at his place,supportive_reaction,caring,raisedbynarcissists,
Iirc she's alive but an alcoholic.,neutral_observation,neutral,RWBY,
I live in a valley so it's effectively earlier than that for me.,supportive_reaction,approval,SeattleWA,
Couldn't happen to a nicer piece of shit.,critical_reaction,annoyance,chicago,
Did you watch highlights of [NAME] vs [NAME]? [NAME] had amazing highlights but he isn’t the one competing for the Hart trophy now.,uncertain_question,curiosity,sabres,
I also hate eating in bed! Snacks that aren’t messy ill eat in bed but that’s it,critical_reaction,disapproval,My600lbLife,
Fact: 2:28 I'll never ger back.,critical_reaction,disappointment,videos,
Seeing the Reverend talk to his son like that always made me feel uncomfortable but also mad.,critical_reaction,annoyance,DunderMifflin,
Do you mean addons exclusive to him? The instasaw bubba is pretty fucking good....,supportive_reaction,admiration,deadbydaylight,
r/btc is the only place in the world who thinks like that while the rest of the world thinks Bcash is a shitcoin nobody uses.,neutral_observation,neutral,btc,
I dont know.. i did message him many times but he didnt reply me.. i am worried about him. I asked his mother about him,supportive_reaction,caring,relationship_advice,
Is that her phone in her back pocket?,neutral_observation,neutral,holdmycosmo,
I've seen her somewhere before,uncertain_question,realization,cringepics,
Elections have consequences.,neutral_observation,neutral,Military,
Upvoted twice because this is EXACTLY what they think it is and it sucks rat balls.,critical_reaction,annoyance,CODZombies,
Maybe next time... Hold that 40 pt L for now.,neutral_observation,neutral,timberwolves,
5 hours late!!!!!!!!! omg.,uncertain_question,surprise,loveafterlockup,
"Count it yourself, you're more off than the original post. [NAME] shot her 9 times.",neutral_observation,neutral,TheWalkingDeadGame,
Since [NAME] are technically [NAME].,critical_reaction,annoyance,Detroit,
I just called the Capitol Police. They are not affected by the shutdown. [NAME] is fucking full of shit.,critical_reaction,disgust,The_Donald,
Did they name Gen X after all the porn they consume?,uncertain_question,curiosity,todayilearned,
"There have been some really good replies in this thread, I hope they help you too! :)",supportive_reaction,gratitude,polyamory,
Are there free vaccines for adults? I thought it was just kids and the elderly?,neutral_observation,neutral,australia,
I just unassigned and left,uncertain_question,realization,doordash,
"Oh god. The pages are still Packers though, right?!",uncertain_question,curiosity,GreenBayPackers,
[NAME] everyone hated that map on lans we played.... but i loved it and forced it up their throat,neutral_observation,neutral,GlobalOffensive,
"It isn't, if it turns out good, and it did.",neutral_observation,neutral,Battlefield,
Seriously. Where I’m from it’s Heinz or excommunication.,neutral_observation,neutral,TalesFromYourServer,
"That's true, but I was surprised to find absolutely ZERO information about a person who , presumably, has quite a bit of power and influence.",uncertain_question,surprise,Scotland,
Happy late birthday :) I hope you got to spend it with someone/doing something that makes you feel happy and whole.,supportive_reaction,optimism,raisedbynarcissists,
There's no better way to make yourself miserable than by comparing yourself to others.,critical_reaction,anger,AskMenOver30,
He figured it out this offseason. He just didn't have any chemistry deep with his receivers and didn't know the playbook,uncertain_question,realization,49ers,
"Oh damn, that would have been the only correct response! ""Sorry, but I have a boyfriend."" End of conversation.",neutral_observation,neutral,thatHappened,
Read divorce busting and kill all marriage counselors. As much as it sucks...youve been given a gift by him giving you time.,uncertain_question,realization,Marriage,
"#YOU'RE RIGHT, PEOPLE BEING OUTRAGED BY THE ACTIONS OF A CRIMINAL IS HYSTERICAL!",neutral_observation,neutral,shieldbro,
Baseless assumptions about cops on Reddit without any context?,uncertain_question,curiosity,youtubehaiku,
I believe he had just recently revived his learners permit and the kid ran a red light.,neutral_observation,neutral,teenagers,
"OH NO, PARENTS ARE SUPPORTIVE😱😱",neutral_observation,neutral,im14andthisisdeep,
"We’re playing well, except for a 2 minute stretch. As is tradition",supportive_reaction,admiration,goldenknights,
[NAME] absolutely embarassed Milksmith in the game we've lost against the Griz. It never would've happened if we had AD.,neutral_observation,neutral,denvernuggets,
"Wow, I was JUST wondering what the bit characters on the show make. $250? - that’s it?!",supportive_reaction,admiration,90DayFiance,
Thank you! Does it contain clinical trails?,supportive_reaction,gratitude,vegan,
I'm not sure I'm following what your point is.,neutral_observation,neutral,conspiracy,
"I do, in fact, want more from OP’s work history",supportive_reaction,approval,TalesFromRetail,
Oh no [NAME] bb what is you doin?,neutral_observation,neutral,NYYankees,
"> the adventure starts in the year 776 Fuck, wait, really?",uncertain_question,curiosity,fireemblem,
Do you have the voting link? I went on the NHL website but I didn't see anything.,uncertain_question,confusion,leafs,
"Think I'm gonna get a chance radio, so I can talk to other car beds.",supportive_reaction,optimism,leafs,
They probably have a couple years to prepare unfortunately.,neutral_observation,neutral,EdmontonOilers,
"Says millennials are afraid of hard work, dismisses the hard work required to get a fit body.",uncertain_question,realization,fatlogic,
I’m not unpleasant with her.,neutral_observation,neutral,DeadBedrooms,
Damn. Also awesome for the victims and others who spoke out about the abuse.,supportive_reaction,admiration,entertainment,
"I swear, this is the most brutal one of this year yet.",neutral_observation,neutral,MurderedByWords,
Nice try hom... oh no it’s real this time D:,supportive_reaction,admiration,walmart,
"Hey, Is this in Portugal? I recognize the francesinha sauce. (greetings from Porto)",uncertain_question,curiosity,WeWantPlates,
fuck off. let people enjoy what they want to enjoy when it doesn't impact you.,uncertain_question,surprise,Portland,
[NAME] was a [NAME]. He's on your people.,neutral_observation,neutral,atheism,
Cried when [NAME] and [NAME] gave each other a big hug and [NAME] lifted him off the ground.,supportive_reaction,love,Gunners,
You're an uneducated twat.,critical_reaction,anger,Unexpected,
Gonna be at the game! Let's get this win boys!,supportive_reaction,optimism,DetroitPistons,
"> even if I despise its many subcultural, life stylist, and mobbish factions I am not sure what this means",critical_reaction,disapproval,Anarchism,
Also why we only get two Senators per state.,uncertain_question,curiosity,PoliticalDiscussion,
"[NAME]? Yeah, that one hurts.",neutral_observation,neutral,rickandmorty,
Thanks. I though it was fooling a penquin.,supportive_reaction,gratitude,Jokes,
[NAME] lines especially. They're all so good because originally [NAME] was going to play that character.,supportive_reaction,approval,NetflixBestOf,
"So birds and limes are bikes. Wow, TIL.",uncertain_question,surprise,Austin,
Is that what it's called now?,uncertain_question,curiosity,2meirl4meirl,
What does all that pill shit they talk about mean anyways? Like what the fuck is a black pill and a red pill?,uncertain_question,confusion,IncelTears,
No it’s a lie because he could not possibly have been in Vietnam. And he did not correct a single outlet who said he was.,critical_reaction,disapproval,Catholicism,
They were just gonna do a review parody of their favorite movie. What’s hard to understand?,uncertain_question,curiosity,RedLetterMedia,
what a dumb moment of faux outrage. can't wait to see what contrived outrage someone thinks up next.,neutral_observation,neutral,ABCDesis,
Crackin open a cold one with the boys Great photo OP,supportive_reaction,admiration,onguardforthee,
"thanks, just sold my house to go all in",supportive_reaction,gratitude,CryptoCurrency,
We’ve bombed plenty of innocent people. How is it any different?,uncertain_question,curiosity,Blackfellas,
"*sighs* One day Blizzard will finally understand that [NAME] teleport is what needs changing and not his damn passive ability. For now, the dream must remain a dream....",neutral_observation,neutral,Overwatch,
"Yeah, and it was 20 years ago and now I feel really old.",critical_reaction,disappointment,sports,
Any chance you have a bank account information you want to share?,uncertain_question,curiosity,youtube,
That’s what I was thinking but the few times I’ve had it happen I got far less than than long pickup + cancel.,uncertain_question,surprise,uberdrivers,
Interesting how [NAME] leads his team in BPM and RPM every year while not being the most important player. Defense and efficiency matters.,uncertain_question,curiosity,GoNets,
You could easily avoid him. What a crazy concept,supportive_reaction,approval,entertainment,
Honestly I’m confused in 10 different ways here,uncertain_question,confusion,oldpeoplefacebook,
I think you have a terrible opinion. Now that we agree on something though this could be the start of a beautiful friendship!,critical_reaction,annoyance,penguins,
Oh. It really is [RELIGION]. I was wondering if that was a bad gag.,uncertain_question,confusion,GifRecipes,
"Probably just unfairly cherry picking things like his words, actions or writings as if those were at all indicative of his beliefs.",neutral_observation,neutral,CanadaPolitics,
Worst CB we’ve had in recent memory,critical_reaction,annoyance,soccer,
You obviously have never seen those creepy videos with 10m+ views with kids. And those Elsagate videos.,critical_reaction,annoyance,youtube,
Does she not know how cups work?,uncertain_question,curiosity,holdmycosmo,
"[NAME] is killing it! I really like her, she's got a future me thinks.",neutral_observation,neutral,leafs,
"Troll, bro. They know they're saying stupid shit. The motherfucker does nothing but stink up libertarian subs talking shit",critical_reaction,anger,Anarcho_Capitalism,
i already gave away too much of the secret it's relevant save yourself before its too late,supportive_reaction,caring,furry_irl,
Everyone has their own preferences I happen to play better when I have multiple balls in my pockets.... no pun intended,supportive_reaction,optimism,tennis,
I play teemo support and nobody can stop me.,neutral_observation,neutral,leagueoflegends,
Our father will protect us <3,supportive_reaction,love,nonononoyes,
[NAME] dude... Hasn't anyone ever told you... Never trust a crackhead NEVER!,neutral_observation,neutral,loveafterlockup,
"lmao im am using ALL of this money to pay my student loans! and starting with a $100 again, see if ill do it again :)",neutral_observation,neutral,sportsbook,
I actually find it easier to place spawn beacons in stupid spots like this than a nice flat empty piece of ground.,supportive_reaction,approval,Battlefield,
"Is that supposed to be outrageous? Assuming he met the requirements and earned them all, good on the guy for planning for his future.",supportive_reaction,approval,politics,
"X+n is an even worse option for class caps, so you have pointed out that an old broken system is now more broken. Thanks.",critical_reaction,disapproval,ontario,
"Same reason the KKK, a radical [RELIGION] group, burns crosses.",neutral_observation,neutral,SelfAwarewolves,
"I suspect that, this is going to be the least infuriating DIY aspect of this house.",critical_reaction,disapproval,mildlyinfuriating,
What documentaries would you recommend? I want to see it.,uncertain_question,curiosity,KotakuInAction,
"Ty! I was going crazy tryin it, canging things... i'l wait then :-)",neutral_observation,neutral,Artifact,
